[
  {"observation_id": "synthetic-tech-001", "claim_id": "TECH-001", "criterion_id": "TECH-001-C1", "metric": "severity_spearman_correlation", "value": 0.41, "sample_size": 250, "source_quality": 0.75, "segments": ["software_development", "cloud_administration", "finance_operations"], "source_type": "synthetic-validation-suite", "dataset_id": "synthetic-250-v1", "collected_at": "2026-06-01T00:00:00Z"},
  {"observation_id": "synthetic-safe-001", "claim_id": "SAFE-001", "criterion_id": "SAFE-001-C1", "metric": "false_release_rate", "value": 0.015, "sample_size": 250, "source_quality": 0.82, "segments": ["high_impact_actions"], "source_type": "synthetic-review-labels", "dataset_id": "synthetic-250-v1", "collected_at": "2026-06-01T00:00:00Z"},
  {"observation_id": "synthetic-advr-001", "claim_id": "ADVR-001", "criterion_id": "ADVR-001-C1", "metric": "metadata_evasion_success_rate", "value": 0.12, "sample_size": 200, "source_quality": 0.85, "segments": ["semantic_rewrite", "signal_omission", "authority_spoofing"], "source_type": "synthetic-red-team", "dataset_id": "synthetic-adversarial-v1", "collected_at": "2026-06-02T00:00:00Z"}
]
